{
  "$schema": "../schemas/profile.schema.json",
  "schema_version": 8,
  "profile": {
    "id": "legacy_no_body_or_head_damage",
    "name": "Daño absoluto cero (migrado)",
    "short_name": "no_body_or_head_damage",
    "description": "Desactiva todo daño del arma, incluida la cabeza.",
    "objective": "Pendiente de revisión: configuración única de un perfil antiguo. Impórtalo como perfil de usuario si lo necesitas.",
    "audience": "",
    "features": [],
    "warnings": [
      "Perfil archivado; no es oficial."
    ],
    "tags": [
      "legacy"
    ],
    "extends": "balanced",
    "revision": 1,
    "created_at": "2026-10-12T23:09:39+0000",
    "migrated_from": "no_body_or_head_damage",
    "migration": "2026-10-12_v8"
  },
  "restore": null,
  "weapon_classification": null,
  "baseline_repair": null,
  "allow_ignored_weapons": null,
  "_documentation": null,
  "modules": {
    "damage": "none",
    "armour": "none",
    "headshot": "off"
  },
  "headshot": {
    "mode": "off",
    "create_missing_tags": true
  },
  "groups": {},
  "harmless_weapons": [
    "WEAPON_SNOWBALL",
    "WEAPON_BALL"
  ],
  "allow_damage_weapons": []
}
