{
  "$schema": "../schemas/profile.schema.json",
  "schema_version": 8,
  "profile": {
    "id": "legacy_pvp_hardcore_onetap",
    "name": "PvP Hardcore One-Tap (migrado)",
    "short_name": "pvp_hardcore_onetap",
    "description": "TTK corporal corto para eventos intensos; mantiene límites de rango y cabeza one-tap real.",
    "objective": "Pendiente de revisión: configuración única de un perfil antiguo. Impórtalo como perfil de usuario si lo necesitas.",
    "audience": "",
    "features": [],
    "warnings": [
      "Perfil archivado; no es oficial."
    ],
    "tags": [
      "legacy"
    ],
    "extends": "competitive",
    "revision": 1,
    "created_at": "2026-10-12T23:09:39+0000",
    "migrated_from": "pvp_hardcore_onetap",
    "migration": "2026-10-12_v8"
  },
  "modules": {
    "armour": "piercing",
    "reload": "fast"
  },
  "groups": {
    "GROUP_PISTOL": {
      "fields": {
        "falloff_min": 95.0,
        "falloff_max": 130.0,
        "falloff_modifier": 0.72,
        "accuracy_spread": 0.85,
        "run_and_gun_accuracy_modifier": 1.1,
        "accurate_mode_accuracy_modifier": 0.55,
        "recoil_accuracy_max": 0.3,
        "recoil_error_time": 0.05,
        "recoil_recovery_rate": 1.55,
        "recoil_shake_amplitude": 0.11,
        "damage": 100.0
      }
    },
    "GROUP_SMG": {
      "fields": {
        "falloff_min": 115.0,
        "falloff_max": 160.0,
        "falloff_modifier": 0.55,
        "accuracy_spread": 1.0,
        "run_and_gun_accuracy_modifier": 1.35,
        "accurate_mode_accuracy_modifier": 0.7,
        "recoil_accuracy_max": 0.38,
        "recoil_error_time": 0.06,
        "recoil_recovery_rate": 1.35,
        "recoil_shake_amplitude": 0.15,
        "damage": 67.0
      }
    },
    "GROUP_RIFLE": {
      "fields": {
        "falloff_min": 245.0,
        "falloff_max": 320.0,
        "falloff_modifier": 0.68,
        "accuracy_spread": 0.92,
        "run_and_gun_accuracy_modifier": 1.25,
        "accurate_mode_accuracy_modifier": 0.62,
        "recoil_accuracy_max": 0.4,
        "recoil_error_time": 0.07,
        "recoil_recovery_rate": 1.25,
        "recoil_shake_amplitude": 0.18,
        "damage": 67.0
      }
    },
    "GROUP_MG": {
      "fields": {
        "falloff_min": 210.0,
        "falloff_max": 280.0,
        "falloff_modifier": 0.62,
        "accuracy_spread": 1.15,
        "run_and_gun_accuracy_modifier": 1.55,
        "accurate_mode_accuracy_modifier": 0.82,
        "recoil_accuracy_max": 0.5,
        "recoil_error_time": 0.08,
        "recoil_recovery_rate": 1.05,
        "recoil_shake_amplitude": 0.23,
        "damage": 57.0
      }
    },
    "GROUP_SHOTGUN": {
      "fields": {
        "falloff_min": 8.0,
        "falloff_max": 18.0,
        "falloff_modifier": 0.1,
        "accuracy_spread": 1.45,
        "run_and_gun_accuracy_modifier": 1.85,
        "accurate_mode_accuracy_modifier": 1.1,
        "recoil_accuracy_max": 0.78,
        "recoil_error_time": 0.12,
        "recoil_recovery_rate": 0.75,
        "recoil_shake_amplitude": 0.44,
        "damage": 45.0
      }
    },
    "GROUP_SNIPER": {
      "fields": {
        "falloff_min": 520.0,
        "falloff_max": 600.0,
        "falloff_modifier": 0.9,
        "accuracy_spread": 0.16,
        "run_and_gun_accuracy_modifier": 1.8,
        "accurate_mode_accuracy_modifier": 0.1,
        "recoil_accuracy_max": 0.85,
        "recoil_error_time": 0.12,
        "recoil_recovery_rate": 0.68,
        "recoil_shake_amplitude": 0.52,
        "damage": 150.0
      }
    }
  }
}
