{
  "$schema": "../schemas/profile.schema.json",
  "schema_version": 8,
  "profile": {
    "id": "legacy_vanilla_normal_custom_plus15_revolver_onetap",
    "name": "Vanilla normal + custom 15% + revolver torso one-shot (migrado)",
    "short_name": "vanilla_normal_custom_pl",
    "description": "Restaura cada weapons.meta desde su .meta.bak cuando existe, conserva las armas oficiales, aumenta un 15% el daño y las distancias de las custom, preserva headshots originales y hace letales al torso los revólveres.",
    "objective": "Pendiente de revisión: configuración única de un perfil antiguo. Impórtalo como perfil de usuario si lo necesitas.",
    "audience": "",
    "features": [],
    "warnings": [
      "Perfil archivado; no es oficial."
    ],
    "tags": [
      "legacy"
    ],
    "extends": "balanced",
    "revision": 1,
    "created_at": "2026-10-12T23:09:39+0000",
    "migrated_from": "vanilla_normal_custom_plus15_revolver_onetap",
    "migration": "2026-10-12_v8"
  },
  "baseline_repair": null,
  "weapon_classification": {
    "custom": {
      "multiplier_base": null,
      "field_multipliers": {
        "network_player_damage_modifier": null,
        "network_ped_damage_modifier": null,
        "hit_limbs": null,
        "network_hit_limbs": null,
        "lightly_armoured": null,
        "vehicle_damage_modifier": null,
        "falloff_modifier": null,
        "headshot_player": null,
        "network_headshot": null,
        "headshot_ai": null,
        "min_headshot_player": null,
        "min_headshot_ai": null,
        "penetration": null,
        "damage": 1.15,
        "weapon_range": 1.15,
        "falloff_min": 1.15,
        "falloff_max": 1.15,
        "max_headshot_player": 1.15,
        "max_headshot_ai": 1.15
      }
    }
  },
  "family_rules": [
    {
      "name": "revolver_one_shot_torso",
      "contains": [
        "REVOLVER",
        "DOUBLEACTION"
      ],
      "groups": [
        "GROUP_PISTOL"
      ],
      "fields": {
        "damage": 350.0,
        "network_player_damage_modifier": 1.0,
        "network_ped_damage_modifier": 1.0,
        "hit_limbs": 0.25,
        "network_hit_limbs": 0.25,
        "lightly_armoured": 1.0,
        "falloff_modifier": 1.0
      }
    }
  ],
  "_documentation": {
    "why_v6": null,
    "runtime": null,
    "official": null,
    "custom": null,
    "headshot": null,
    "why_v6_1": null,
    "network_modifiers": null,
    "official_behavior": "Las armas presentes en el catálogo oficial de Cfx.re no reciben multiplicadores ni valores fijos, salvo los revólveres por la regla explícita.",
    "custom_behavior": "Cualquier arma no presente en el catálogo oficial y perteneciente a un grupo de arma de fuego recibe +15% sobre los valores originales del propio META.",
    "restore_behavior": "Si existe weapons.meta.bak, ese archivo es la base original. Si no existe, el programa usa el META actual y lo informa como advertencia.",
    "headshots": "Los multiplicadores de daño de cabeza se conservan; solo se amplía 15% la distancia máxima de headshot de las custom cuando el tag existe.",
    "revolver_note": "GTA no expone un campo exclusivo de pecho en weapons.meta. El torso usa Damage completo y las extremidades se reducen con HitLimbsDamageModifier."
  }
}
