{
  "$schema": "../schemas/profile.schema.json",
  "schema_version": 8,
  "profile": {
    "id": "flow_onetap",
    "name": "Flow One-Tap Pistolas",
    "short_name": "Flow One-Tap Pistolas",
    "description": "Pistolas one-tap a la cabeza hasta 100 m (pesadas 140 m); rifles, SMG y MG sin bonus de cabeza; escopetas brutales de cerca y flojas de lejos; francotirador 1 a la cabeza hasta 50 m.",
    "objective": "",
    "audience": "",
    "features": [],
    "warnings": [],
    "extends": "flow_custom",
    "tags": [],
    "revision": 51,
    "created_at": "2026-10-17T05:26:55+0000",
    "updated_at": "2026-10-17T05:28:57+0000"
  },
  "groups": {
    "GROUP_PISTOL": {
      "headshot": {
        "mode": "onetap",
        "distance": 100
      }
    },
    "GROUP_RIFLE": {
      "headshot": {
        "multiplier": 1.0
      }
    },
    "GROUP_SMG": {
      "headshot": {
        "multiplier": 1.0
      }
    },
    "GROUP_MG": {
      "headshot": {
        "multiplier": 1.0
      }
    },
    "GROUP_SNIPER": {
      "headshot": {
        "distance": 50
      },
      "fields": {
        "damage": 51
      }
    },
    "GROUP_SHOTGUN": {
      "fields": {
        "damage": 24,
        "weapon_range": 40,
        "falloff_min": 6,
        "falloff_max": 20,
        "falloff_modifier": 0.15
      }
    }
  },
  "weapons": {
    "WEAPON_CERAMICPISTOL": {
      "headshot": {
        "distance": 100
      }
    },
    "WEAPON_COMBATPISTOL": {
      "headshot": {
        "distance": 100
      }
    },
    "WEAPON_COMBATPISTOLNAVIDAD": {
      "headshot": {
        "distance": 100
      }
    },
    "WEAPON_DARKSIDEGLOCK": {
      "headshot": {
        "distance": 100
      }
    },
    "WEAPON_FN57": {
      "headshot": {
        "distance": 100
      }
    },
    "WEAPON_GLIZZYG17": {
      "headshot": {
        "distance": 100
      }
    },
    "WEAPON_GLIZZYG17L": {
      "headshot": {
        "distance": 100
      }
    },
    "WEAPON_GLIZZYG19": {
      "headshot": {
        "distance": 100
      }
    },
    "WEAPON_GLIZZYG21B": {
      "headshot": {
        "distance": 100
      }
    },
    "WEAPON_GLIZZYG30": {
      "headshot": {
        "distance": 100
      }
    },
    "WEAPON_GLIZZYG40": {
      "headshot": {
        "distance": 100
      }
    },
    "WEAPON_ILLGLOCK17": {
      "headshot": {
        "distance": 100
      }
    },
    "WEAPON_MGGLOCK": {
      "headshot": {
        "distance": 100
      }
    },
    "WEAPON_ODGLOCK": {
      "headshot": {
        "distance": 100
      }
    },
    "WEAPON_P210": {
      "headshot": {
        "distance": 100
      }
    },
    "WEAPON_P30L": {
      "headshot": {
        "distance": 100
      }
    },
    "WEAPON_PISTOL": {
      "headshot": {
        "distance": 100
      }
    },
    "WEAPON_PISTOLGIRL": {
      "headshot": {
        "distance": 100
      }
    },
    "WEAPON_PISTOLXM3": {
      "headshot": {
        "distance": 100
      }
    },
    "WEAPON_PISTOL_MK2": {
      "headshot": {
        "distance": 100
      }
    },
    "WEAPON_SKYGLOCK": {
      "headshot": {
        "distance": 100
      }
    },
    "WEAPON_SR40": {
      "headshot": {
        "distance": 100
      }
    },
    "WEAPON_VINTAGEPISTOL": {
      "headshot": {
        "distance": 100
      }
    },
    "WEAPON_PISTOL50": {
      "headshot": {
        "mode": "onetap",
        "distance": 140
      }
    },
    "WEAPON_GADGETPISTOL": {
      "headshot": {
        "mode": "onetap",
        "distance": 140
      }
    },
    "WEAPON_REVOLVER": {
      "headshot": {
        "mode": "onetap",
        "distance": 140
      },
      "fields": {
        "weapon_range": 200,
        "falloff_min": 150,
        "falloff_max": 200,
        "falloff_modifier": 0.8
      }
    },
    "WEAPON_REVOLVER_MK2": {
      "headshot": {
        "mode": "onetap",
        "distance": 140
      },
      "fields": {
        "weapon_range": 200,
        "falloff_min": 150,
        "falloff_max": 200,
        "falloff_modifier": 0.8
      }
    },
    "WEAPON_DOUBLEACTION": {
      "headshot": {
        "mode": "onetap",
        "distance": 140
      },
      "fields": {
        "weapon_range": 200,
        "falloff_min": 150,
        "falloff_max": 200,
        "falloff_modifier": 0.8
      }
    },
    "WEAPON_NAVYREVOLVER": {
      "headshot": {
        "mode": "onetap",
        "distance": 140
      },
      "fields": {
        "weapon_range": 200,
        "falloff_min": 150,
        "falloff_max": 200,
        "falloff_modifier": 0.8
      }
    },
    "WEAPON_HEAVYPISTOL": {
      "headshot": {
        "mode": "onetap",
        "distance": 140
      },
      "fields": {
        "weapon_range": 200,
        "falloff_min": 150,
        "falloff_max": 200,
        "falloff_modifier": 0.8
      }
    },
    "WEAPON_MARKSMANPISTOL": {
      "headshot": {
        "mode": "onetap",
        "distance": 140
      },
      "fields": {
        "weapon_range": 200,
        "falloff_min": 150,
        "falloff_max": 200,
        "falloff_modifier": 0.8
      }
    },
    "WEAPON_APPISTOL": {
      "headshot": {
        "mode": "onetap",
        "distance": 15
      }
    },
    "WEAPON_GLIZZYG26SWITCH": {
      "headshot": {
        "mode": "onetap",
        "distance": 15
      }
    },
    "WEAPON_HEAVYSHOTGUN": {
      "fields": {
        "damage": 80
      }
    },
    "WEAPON_ASSAULTSHOTGUN": {
      "fields": {
        "damage": 15
      }
    },
    "WEAPON_AUTOSHOTGUN": {
      "fields": {
        "damage": 15
      }
    }
  },
  "fire_rate_classifier": {
    "onetap_allowed_groups": [
      "GROUP_SNIPER",
      "GROUP_PISTOL"
    ],
    "non_normal_damage_caps": {
      "GROUP_PISTOL": 9.0,
      "GROUP_SMG": 13.0,
      "GROUP_RIFLE": 14.0,
      "GROUP_MG": 13.0,
      "GROUP_SHOTGUN": 24.0,
      "GROUP_SNIPER": 37.0
    }
  }
}
