{
  "$schema": "../schemas/profile.schema.json",
  "schema_version": 8,
  "profile": {
    "id": "legacy_original_body_real_onetap",
    "name": "Original Body Damage + Real One-Tap (migrado)",
    "short_name": "original_body_real_oneta",
    "description": "Conserva daño, recoil, cadencia y recarga originales; solo normaliza la ruta META del headshot y casco.",
    "objective": "Pendiente de revisión: configuración única de un perfil antiguo. Impórtalo como perfil de usuario si lo necesitas.",
    "audience": "",
    "features": [],
    "warnings": [
      "Perfil archivado; no es oficial."
    ],
    "tags": [
      "legacy"
    ],
    "extends": "competitive",
    "revision": 1,
    "created_at": "2026-10-12T23:09:39+0000",
    "migrated_from": "original_body_real_onetap",
    "migration": "2026-10-12_v8"
  },
  "modules": {
    "damage": "original",
    "armour": "original",
    "recoil": "original",
    "accuracy": "original",
    "range": "original",
    "fire_rate": "original"
  },
  "groups": {
    "GROUP_PISTOL": {
      "fields": {
        "weapon_range": null,
        "hit_limbs": null,
        "network_hit_limbs": null,
        "vehicle_damage_modifier": null,
        "time_between_shots": null,
        "damage": null
      }
    },
    "GROUP_SMG": {
      "fields": {
        "weapon_range": null,
        "hit_limbs": null,
        "network_hit_limbs": null,
        "vehicle_damage_modifier": null,
        "time_between_shots": null,
        "damage": null
      }
    },
    "GROUP_RIFLE": {
      "fields": {
        "weapon_range": null,
        "hit_limbs": null,
        "network_hit_limbs": null,
        "vehicle_damage_modifier": null,
        "time_between_shots": null,
        "damage": null
      }
    },
    "GROUP_MG": {
      "fields": {
        "weapon_range": null,
        "hit_limbs": null,
        "network_hit_limbs": null,
        "vehicle_damage_modifier": null,
        "time_between_shots": null,
        "damage": null
      }
    },
    "GROUP_SHOTGUN": {
      "fields": {
        "weapon_range": null,
        "hit_limbs": null,
        "network_hit_limbs": null,
        "vehicle_damage_modifier": null,
        "time_between_shots": null,
        "damage": null
      }
    },
    "GROUP_SNIPER": {
      "fields": {
        "weapon_range": null,
        "hit_limbs": null,
        "network_hit_limbs": null,
        "vehicle_damage_modifier": null,
        "time_between_shots": null,
        "damage": null
      }
    }
  }
}
